videoid,description,page_idx,page_dir,duration,contentUrl
100278,"a view of a town with a group of people walking around a white building and down a street, a clock tower in the middle of the town, and a train station with a sky background.",,,,
100280,"an aerial view of a rural village located in the middle of a field, the scene includes farmland, mountains in the background, and a field.",,,,
100281,"a view from a vehicle of a field with white flowers, trees, and an apple orchard in bloom, including a blurry photo of a tree with the words air plane on it.",,,,
100282,"a picture of a woman in a white dress standing in a blurry, virtual field with flowers, trees and grass.",,,,
100283,"a picture of a field with trees, flowers and an apple tree, including a blurry view of an apple tree.",,,,
100284,"a picture of a field with trees, flowers, and a 3D image of a bride and groom in an apple orchard.",,,,
100285,a 3d image of a woman in a white dress walking through a field with apple trees and flowers in an orchard.,,,,
100286,"an aerial 3D view of a person flying a kite in a desert landscape, the landscape including a dirt field, mountains in the background",,,,
100287,"a 3D aerial view of a mountain with a sky background, the scene includes clouds and a dirt field.",,,,
100288,"a panoramic and aerial view of a mountain range with a sky background, including a large body of water.",,,,
100289,"a 360 view of a scene including a dirt road with a hill, a beach with mountains, a mountain with steam coming out of it, and a desert with a mountain in the background.",,,,
100290,"an aerial view of a foggy mountain range with a geyser spewing out water, a river running through it, and a blurry photo of the same river with mountains in the background.",,,,
100291,"a panoramic and bird's eye view of a cliff in the mountains and desert, the landscape including trees and cliff face.",,,,
100292,"a panoramic and aerial view of a canyon in the mountains with a rocky cliff, a field with a sunset in the background and a mountain in the background.",,,,
100293,"a panoramic view of a canyon at sunset, the scene includes a mountain, a man riding a bike down a dirt road, and a rocky cliff.",,,,
100294,"a panoramic view of a desert at sunset, featuring a cliff, a canyon, trees in the background, and a rocky cliff with trees on top.",,,,
100295,"a panoramic view of a large waterfall from a helicopter, including a river with a rainbow in the sky and a view of the water from a boat.",,,,
100296,"a blurry photo of a green wall with a plant growing on it, featuring a painting of a waterfall in the woods and an image of the plant growing on the side of a building.",,,,
100297,"a blurry photo of an airplane flying over a waterfall and a forest filled with trees and bushes, with a light coming out of a cave.",,,,
100298,"a 3D image of a man standing in front of a waterfall in a lush green forest, which is adjacent to a room with a bed and a curtain hanging from the ceiling.",,,,
100299,"a blurry photo of a man standing on a street with trees, a plant with the words airpano, and a waterfall in the background, and a body of water also present in the scene.",,,,
100300,"a picture of a large waterfall with water cascading down its sides taken from a boat, including a panoramic view of a foggy lake, and a blurry view of a forest with rocks and trees.",,,,
100301,"a blurry photo of boats, including a gondola, traveling down a river next to tall buildings, with an airpano logo and a canal in front of a building",,,,
100303,"a gondola going down a canal with people on it, with a man riding a boat down a river, surrounded by tall buildings in the background.",,,,
100304,"a scene featuring a narrow canal with gondolas, a man in a white suit standing next to a car, a building with a boat in front of it, and a gondola moving down a narrow city street.",,,,
100307,a crowd of people walking down a street next to tall buildings,,,,
100308,"a boat traveling down a narrow canal next to tall buildings with graffiti, under a bridge on a river, with a couple of people riding a gondola.",,,,
100309,"a boat and a gondola with a stuffed animal on the front traveling down a large body of water next to tall buildings, with a large building sitting on the side of the river.",,,,
100310,"a couple of people, including a man in a white costume and a woman in a red and white dress, are traveling down a river on a boat, the scene also featuring tall buildings nearby.",,,,
100311,"a man riding a boat traveling down a river under a bridge, the river next to tall buildings and a building near a bridge over the water.",,,,
100313,a group of people walking down a street next to tall buildings,,,,
100314,a large crowd of people walking down a street next to tall buildings.,,,,
100315,"a group of people walking down a city street next to tall buildings, the city street appearing blurry with people walking around, and a building with people walking by.",,,,
100316,"a group of people in a skate park, standing in front of a building, walking down a street next to a hill and across a parking lot.",,,,
100317,"a panoramic aerial view of a lush green forest with a river, the forest includes a tree in the woods and a wooded area with trees.",,,,
100318,"a view of a group of people sitting on a bench next to a river, with a bunch of pandas standing in the grass and a wooden walkway in the woods",,,,
100319,"a group of panda bears laying in the grass on top of a pile of hay, one of them next to a river, with people standing on a bridge over the river.",,,,
100320,"a blurry photo of a group of people and a person standing on a bridge, the people sitting on a bench next to a river with a group of panda bears laying on top of a pile of bamboo and a cat sitting on a wooden floor.",,,,
100321,"a blurry photo of a group of people and animals on a wooden deck in the woods, standing on top of a bridge, and a man riding a bike down a dirt road, with the scene set in the grass.",,,,
100322,"a panoramic view of a lush green park with buildings surrounded by trees, one of which is in the middle of a field.",,,,
100323,a group of people walking down a street with a small car parked on the side of the road.,,,,
100324,"a blurry photo of a dog running through a park with a river, trees and a group of people standing in front of a tree.",,,,
100325,"an aerial view of a garden with a bird perched on a tree branch, a wooden bench sitting next to a forest filled with trees and a tree in a wooded area with no leaves.",,,,
100326,"a blurry photo of a car and a motorcycle driving down a street with trees, next to a bridge in the woods and a forest.",,,,
100327,"a blurry photo of a lush green forest with a tree in the middle, a road surrounded by trees, as seen from a bird's eye view.",,,,
100328,"a blurry photo of a park with a tree, a building, a tennis court with people watching, and a forest with a river in the background.",,,,
100329,"a blurry image of a lush green field with a panda bear sitting next to a tree, a tennis ball in the grass, a park bench and trees, and a group of people standing on top",,,,
100330,"a group of people and a person riding a bike in a forest with a wooden path, where a sign and a panda bear are present.",,,,
100331,"an aerial panoramic view from a plane of a lush green field with trees, a city and a river.",,,,
100334,"a blurry image of a car and a white van driving down a street next to a lush green park with a forest, the street surrounded by trees and grass.",,,,
100335,"a view of a group of people both riding down and standing by a river next to a forest, with a bench in the woods and a pond, the river running through a park.",,,,
100336,"a blurry image of people sitting in a park with woods, a river running through it and a dog walking, the people are sitting on a bench next to the river and on a bridge over the body of water.",,,,
100337,"an aerial view of a large body of water next to a lush green hillside, with a bridge over it and mountains in the background, also including a blurry photo of the same body of water.",,,,
100338,"a picture of a large white building sitting in the middle of a lake, with a boat floating on top of the water, a bridge in the background, and a sky background.",,,,
100339,"a panoramic and aerial view of a castle and a bridge overlooking a body of water, including a lake with a sky background.",,,,
100340,"a panoramic and aerial view of a castle by a lake, the lake including a bridge and a blurry view of the water.",,,,
100342,"a panoramic aerial view of a city with a cathedral, a river running through it, a cloudy sky, and a train on the tracks.",,,,
100343,"a panoramic and aerial view of a city with a river running through it, a train station, tall buildings, and visible from a plane.",,,,
100344,"a panoramic aerial view of a city with a church, a river running through it, buildings, and a large industrial area.",,,,
100348,"a panoramic and aerial view of a coastal town with a lake, the scene includes boats sitting in the water, a body of water, rocks and a dock.",,,,
100349,"a view of a beach, a house on a small island, a hill, all from a boat in the middle of a body of water.",,,,
100350,"a panoramic view of a town by the ocean, the town including a city with mountains in the background, viewed from a cliff, and a lush green hillside",,,,
100351,"a blurry aerial view of a village on a cliff overlooking the ocean under a cloudy sky, the scene including a body of water.",,,,
100352,"a scenic view of the ocean near a cliff, seen from a boat, with the sun shining over the water.",,,,
100353,"a panoramic and aerial view of a beach with people on it, a boat in the water and a body of water.",,,,
100355,"an underwater photo of a man swimming in the ocean next to a group of sharks, a large group of fish over a coral reef and a shipwreck.",,,,
100356,"a large group of sharks including a large white shark swimming in the ocean, with a man and another person also swimming, and a boat in the background.",,,,
100357,"a group of sharks, including a large white shark, swimming in the ocean with a net in the background, along with a group of dolphins.",,,,
100358,"a group of people and a man swimming in the ocean with a group of sharks, including a close up of a large shark.",,,,
100359,a picture of a large group of fish and a shark swimming in the ocean.,,,,
100360,"a person in a wet suit swimming in the ocean with a boat in the background, accompanied by two dolphins and a group of sharks, including a large shark.",,,,
100361,a large group of fish and a dolphin swimming in the ocean,,,,
100362,"a man in the ocean, swimming with a shark nearby, riding a surfboard on a wave, standing on a railing in the water and on top of a cage.",,,,
100363,a large group of fish swimming and birds flying over a blue ocean.,,,,
100364,"a large group of fish and a man riding a surfboard in the ocean, with a man standing in a cage containing fish in the water.",,,,
100365,"a group of people standing on top of a cage under water in the ocean, where dolphins, a great white shark and a large group of fish are swimming.",,,,
100366,"an underwater view of a man in a wet suit diving over a coral reef in the ocean, the reef includes a fish, green seaweed, and a seabed with algae.",,,,
100367,"an underwater view in the ocean including a rock formation, a coral reef with rocks and algae, a man scuba diving with a camera over the reef",,,,
100368,"a man is diving in a large body of water, featuring an underwater view of a boat floating on top, a coral reef, and an ocean with a logo on it.",,,,
100369,"an underwater view in the ocean, featuring a turtle swimming over a coral reef, a wreck, and algae growing on the reef, surrounded by blue water.",,,,
100370,"an underwater view of a person swimming in the ocean over a coral reef with a sea turtle, a large group of fish, and algae.",,,,
100371,"an underwater view of a person and a man swimming in the ocean with a turtle, over a coral reef and a ship wreck on the ocean floor.",,,,
100372,"an underwater view of a large turtle swimming over a coral reef in the ocean, the coral reef with the word airpano over it.",,,,
100373,"a blurry photo of a man swimming and riding a surfboard in the large blue ocean, a turtle also swims in the ocean with an airpano logo.",,,,
100374,"an underwater view of a turtle swimming over a coral reef in the ocean, the reef surrounded by seaweed and rock.",,,,
100375,"an underwater view of the ocean, featuring a shipwreck on the seabed with algae and rocks, a large turtle swimming, and a coral reef.",,,,
100376,"an underwater view of a person swimming with a camera in the ocean over a coral reef with seaweed growing on it, a turtle swimming, and a diver in the background.",,,,
100377,a large group of fish swimming over a coral reef with a man scuba diving in the ocean,,,,
100379,"a large group of fish and a man swimming in the ocean, the ocean with an airpano logo and blue water.",,,,
100380,"an underwater view of a man scuba diving over a coral and rocky reef in the ocean, the reef has a cloud-shaped object, the word 'pano' and a name written on it",,,,
100381,"a picture of a desert with a group of people riding camels, cars parked in front of a pyramid, animals walking across a sandy field, and a horse with a carriage.",,,,
100382,a blurry photo of a very large pyramid in the middle of a desert landscape,,,,
100383,a view of a man and a group of people riding camels and horses in the desert in front of a pyramid.,,,,
100384,a picture of a man and a group of people riding camels in a desert with a pyramid and a dirt road in the background,,,,
100385,"an aerial view of the desert with a blue sky, featuring three large pyramids, one of which is depicted in a 3D image.",,,,
100386,"a man riding a horse drawn carriage and a camel in front of a pyramid, with a group of people riding on the backs of camels and cars parked on a sandy beach.",,,,
100387,"a man riding a white horse in a blurry image of the desert, with a camel in front of the Pyramids of Giza and a dirt road in the background.",,,,
100388,"a person riding a horse in a desert with three pyramids in the background, and a truck in the foreground.",,,,
100389,"a panoramic and aerial 3D view of the three pyramids of Giza in the desert, the desert including rocks and sand.",,,,
100390,"an aerial view of a desert scene, with a group of people riding camels, some camels laying down in the dirt, a camel walking across the desert, and a sign in the foreground.",,,,
100391,"a picture of a man riding a brown horse across a sandy field in the desert, with a very tall pyramid and a large rock sitting on top of a sandy beach.",,,,
100393,a blurry photo of a blue and orange helicopter and a plane flying over the ocean and a beach in the sky.,,,,
100394,"a blurry photo of an orange and blue helicopter flying over the ocean, with a boat in the water and a red and black object in the sky.",,,,
100395,"a computer generated image of a mountain with a plume of smoke, a red and blue helicopter, a red helicopter and a plane flying over a snow covered ground and a large body of water.",,,,
100396,"a large plume of smoke coming out of a volcano with a helicopter and a plane flying over it, the scene includes a mountain at sunset, a large body of water and the ocean.",,,,
100397,"a blurry photo of a red and blue helicopter and a plane flying over a mountain with a sky background, the scene includes a desert and the ocean.",,,,
100398,"a computer-generated image of a plane and a red and blue helicopter flying over a desert landscape and a snow-covered mountain, under a cloudy sky.",,,,
100399,"a large plume of smoke coming out of the ocean, with a plane and a red and blue helicopter flying over a snow-covered mountain, and a person flying a kite over a snow-covered field.",,,,
100400,"a scene featuring a plane and helicopters flying over a large body of water covered with lava and a mountain, the helicopters are red and white, and red and blue.",,,,
100402,"a blurry image of a car driving on a road, a helicopter flying over the ocean and a snow-covered ground, with a beach and a mountain in the background.",,,,
100403,"a blurry photo of a plane and a red and blue helicopter flying over a frozen lake at sunset, with a boat in the water and a car in the snow.",,,,
100404,"a view of the sky with a red helicopter flying over a snow covered mountain, a blurry plane over a body of water, and a red and blue airplane flying in the sky, all seen from an airplane.",,,,
100405,"The output is: a computer generated image of a mountain covered in snow in the middle of the ocean under a cloudy sky, with a red and blue helicopter and a plane flying over.",,,,
100406,"an aerial view from an airplane of a snowy mountain at sunset with a red line going up it, including views of the sky and clouds.",,,,
100407,"a red airplane flying over a snow-covered mountain with a cloud-filled sky, the view captured from the plane itself.",,,,
100408,"a plane, possibly red, flying over a mountain covered in clouds, also over a large body of water, with a sky background.",,,,
100409,"an aerial view combining a volcano with smoke coming out, a body of water under clouds, a snow-covered mountain, and a sunset over the ocean.",,,,
100410,"a red and blue plane flying over a mountain and a body of water, the view including a helicopter and the ocean as seen from the plane.",,,,
100412,"a panoramic view from a plane, featuring a river, land, a wide open field, a city, and a desert with a sky background.",,,,
100413,"a red airplane is flying over a snowy field and a sandy beach, with a person skiing on the snow covered slope.",,,,
100414,"a windmill sitting on top of a green field next to a body of water, the field also showing a red roof, with a panoramic view of the adjacent river.",,,,
100416,a panoramic aerial view of a group of windmills next to a lush green field with a river running through it.,,,,
100418,"a view of a windmill sitting on top of a lush green field next to a large body of water, with a river in the distance and a boat in it.",,,,
100419,an aerial view of a wide river running through a lush green countryside with a windmill.,,,,
100420,"an aerial view of a lush green countryside with a wide river running through it, surrounded by fields, including a windmill.",,,,
100421,"a wide shot of the ocean from a plane, the ocean including ice floes, icebergs floating in the background, and a computer generated image of icebergs",,,,
100422,"a panoramic view of a snow covered field with a mountain, a river running through it, and a sky background, also including a snowboarder doing a trick in the air.",,,,
100423,"an aerial view of a large iceberg floating on a large body of water, the view including ice floes in the ocean.",,,,
100424,"a computer generated image of a plane flying over an icy landscape, the landscape including a snow covered mountain, a large iceberg floating in the ocean.",,,,
100425,"a large iceberg and a large wave in the ocean, with a plane and an airplane flying over the body of water.",,,,
100426,"an aerial view at sunset featuring a lake surrounded by a forest, all under a blue sky",,,,
100427,"an aerial view of a large lake at sunset, surrounded by a forest with many trees.",,,,
100428,"a large body of water next to a lush green field, sitting under a cloudy blue sky, surrounded by a forest, with an aerial view of the forest and the lake.",,,,
100429,"a couple of people and a person in a costume riding on a boat, traveling down a river next to tall buildings.",,,,
100430,"a helicopter flying over a lush green field with a tree in the middle, a farm in the background, and a wooded area with trees",,,,
100431,"a boat with two people traveling across a large body of water under a cloudy sky, the water is surrounded by mountains.",,,,
100432,"a dog is swimming and standing in the water near a beach, with an aerial and fish eye view of the river, trees, and the beach.",,,,
100433,"an image of an elephant and a dog near a body of water, specifically a river with trees in the background and a dirt field with trees.",,,,
100434,a computer generated 3D image of a wide angle view of a rocky river running through a lush green forest with a mountain in the background.,,,,
100435,"a 3D image of a man riding a bike down a dirt road near a cliff, with a bear swimming in a nearby river that has trees in it.",,,,
100436,a couple of men riding on the back of a small boat on top of a lake at sunset.,,,,
100437,"a blurry image of a house in the middle of a large field with a sign that says pano, the field has a lake in the background.",,,,
100438,"The output is: an aerial view of a group of people on a golf course field with tents, a grassy field, a lake in the background, and a boat on a body of water.",,,,
100439,"a blurry photo of a plane flying over a green field with a red and white truck, mountains in the background, and a sign in the middle of it",,,,
100440,"a wide shot of a dog walking across a river with rocks and grass in a lush green countryside, with a mountain in the background.",,,,
100441,a panoramic view of a lush green countryside with a river running through it,,,,
100442,"a brown bear standing on top of a lush green countryside, with a river running through it.",,,,
100443,"an aerial view of an airport runway next to a grassy field, the scene includes a body of water, a mountain, a sandy beach next to the ocean, a plane and a white helicopter flying over a road.",,,,
100444,"a panoramic aerial view of a large body of water, presumably a lake, surrounded by land and mountains, with a plane and a white helicopter flying over it, and a lush green field nearby.",,,,
100445,"an aerial and panoramic view of a large body of water, including a lake and mountains, with a computer-generated airplane and a helicopter flying over it.",,,,
100446,"an aerial and panoramic view of a large body of water including a lake and mountains, with an airplane and a white helicopter flying over it.",,,,
100449,"an aerial view of a large body of water including a beach, a plane and a helicopter flying over, with a snow covered ground nearby.",,,,
100451,"a view of a body of water at sunset, the water featuring a large iceberg floating in the middle and a hill in the background, a helicopter is flying over the scene.",,,,
100453,"a panoramic view of a large body of water with the sun shining over a bridge, an aerial view of the same bridge over a river.",,,,
100454,"an aerial view of a castle in the middle of a large body of water at sunset, with a boat in it.",,,,
100455,"an aerial view of a train crossing a bridge over a highway and a river, the scene includes a train track",,,,
100456,"a panoramic and aerial view of a city with a train on the tracks, seen from a bridge and a bird's eye view, including a view of a bridge over a river.",,,,
100458,"a panoramic view of a city with a bridge over a river and a mountain in the background, the city has buildings on one side of the river and a large body of water on the other side.",,,,
100459,"a panoramic and aerial view of a river running through a city, the city including tall buildings, a large white building with a clock tower, and a bridge in the background.",,,,
100460,"a panoramic view of a city with tall buildings and mountains in the background, a river running through the city",,,,
100461,"a panoramic and aerial view of a city with mountains in the background and a river running through it, the city seen from a bird's eye view.",,,,
100462,a large crowd of people walking and standing in a street next to tall buildings.,,,,
100463,a large crowd of people and a group of people riding motorcycles down a street next to tall buildings.,,,,
100464,"a crowd of people walking down a street next to tall buildings, holding red flags and walking in front of a red building.",,,,
100465,"a large crowd of people walking down a street, standing in front and around a building",,,,
100466,"a snowboarder is doing a trick in the air over a snow-covered mountain, the scene including a plane flying over and a view of the mountain top.",,,,
100467,"a view from a hot air balloon of a plane flying over a snow covered mountain range, with a clear sky background.",,,,
100468,"a 3d image of a snowy mountain range with a sky background, including views from a ski lift and a plane, and an airplane flying over",,,,
100469,"an aerial view of a snow covered mountain range with a blue sky in the background, as viewed from a plane.",,,,
100470,"a 3D image of a snow covered mountain with a sky background, a snowboarder doing a trick in the air, and the word airpano over it.",,,,
100471,"a panoramic aerial view of a snow covered mountain range from a plane, with a picture of a mountain having the word airpano over it.",,,,
100472,a view from a plane of a snow covered mountain range with a blue sky in the background and the word airpano above it.,,,,
100473,"a picture of a large crowd of people around a building, the crowd is walking down a street, standing in front of the building.",,,,
100475,"a large crowd of people standing and walking around a parking lot, a street and in front of a building.",,,,
100476,"a large crowd of people walking across a parking lot, down a street and standing in front of a building.",,,,
100477,"a large group of people standing in a stadium, on top of a street, in front of a building and around in front of a crowd.",,,,
100478,"a panoramic view of a sunny, snow covered mountain under a blue sky, as seen from a plane.",,,,
100479,"a view of a snow covered mountain with a bright sun and a blue sky in the background, seen from a plane and an aerial view.",,,,
100480,"an aerial view from a plane of a snowy mountain landscape under the bright sun, with a snow covered mountain and a sky background.",,,,
