videoid,description,page_idx,page_dir,duration,contentUrl
100481,"a view of a large waterfall on a mountain with lots of water coming out, the mountain has a river running through it, the river also runs through a lush green valley and a rocky valley.",,,,
100482,"a picture of a river running through a lush green valley and hillside, with a field, rocks, flowers, and grass in the mountains in the foreground",,,,
100483,"an aerial and panoramic view of a city at sunset, the city including a large white building, with the word airpano in the foreground",,,,
100484,"an aerial view of a city and a green field at sunset, including a large building in the middle of a park.",,,,
100485,"a computer generated image of a green and blue sky over a body of water, featuring a full moon and a mountain.",,,,
100486,"a computer generated image of a green and blue aurora bore over a body of water at night, including a mountain lake and a river.",,,,
100487,"a view of a green aurora bore over a lake with a red house and a wooden dock next to it, mountains in the background and a red building with a white window and a red roof.",,,,
100488,"a view of a lake with rocks and a mountain in the background, a red house sitting on top of a rocky beach, under the bright shine of a full moon.",,,,
100489,"a panoramic long exposure photo of a lake at night, the lake surrounded by mountains, a house on the shore, a beach, and the aurora lights shining brightly over the water.",,,,
100490,"a blurry photo of a frozen lake with a waterfall and trees in the background, a snow covered road also included in the scene.",,,,
100491,"an aerial view of a snow covered mountain with a river running through it, the river is surrounded by snow covered trees.",,,,
100492,a snowboarder is going down a snow covered mountain side with a wooden fence and a frozen waterfall in the middle of winter,,,,
100493,"a frozen waterfall in the middle of a snow covered forest in winter, the forest including a path, a river, a stream and snow covered trees.",,,,
100494,"a snowy landscape with a frozen river flowing through a snow covered forest, featuring a frozen cliff, a waterfall and a body of water in the foreground.",,,,
100495,an aerial view of a snow covered forest,,,,
100496,"an aerial view of a frozen body of water in the woods, the body of water including a lake, a waterfall, and a river, surrounded by snow covered trees.",,,,
100497,"an aerial view of a snow-covered landscape, featuring a frozen waterfall in the middle of a forest, a river, and a mountain.",,,,
100498,"a snowy landscape with a couple of people walking up a hill, a person riding skis down a slope, and features like trees, bushes, and a body of water, all covered in snow.",,,,
100499,"The output is: a frozen waterfall in the middle of a snow covered forest in winter, with trees, rocks, a road nearby, and a person walking down a snow covered path.",,,,
100500,"a snowy landscape featuring a frozen waterfall in the middle of a forest, accompanied by a river and trees.",,,,
100501,"a river running through a snow covered forest, surrounded by trees, with two people walking along a snowy path next to the body of water.",,,,
100502,"an aerial view of a winter scene featuring a frozen waterfall in a snow-covered forest, with a river flowing through it.",,,,
100503,"a frozen waterfall in the middle of winter with a group of people standing on top of a snow covered mountain, the scene includes a mountain side with a sky background.",,,,
100504,"a blurry photo of a snowy landscape, featuring trees, a forest and a boat in the water.",,,,
100505,"a green and blue aurora bore over the ocean with a lighthouse, along with a blurry view of a city at night",,,,
100506,"a view of a green and blue aurora bore and a red lighthouse over the ocean at night, with a person sitting on a bench in front of the ocean",,,,
100507,a panoramic aerial view of a city with a bridge over a river running through it,,,,
100508,"a panoramic view of a city from a rooftop, the city is next to a body of water, with a bridge over a river and a large boat floating on it.",,,,
100509,"a panoramic and aerial view of a city with a red roof, including a bridge over a river running through the city.",,,,
100510,a panoramic and aerial view of a city with a bridge over a river running through it,,,,
100511,"a panoramic view of a city on the water with a bridge in the background, including a blurry photo of a boat docked in a harbor, and an aerial view of boats on a river.",,,,
100512,"a panoramic aerial view of a city with a river running through it, a harbor, a hill in the background, and the ocean.",,,,
100513,a panoramic and bird's eye view of a city at sunset with a large body of water and a river running through it.,,,,
100514,"a panoramic and aerial view of a lake, a beach, a mountain and a dirt road in the mountains, with the sun shining over the water and clouds.",,,,
100515,"a large body of water, possibly a lake, surrounded by a forest with people riding in a boat and a man on a jet ski.",,,,
100516,"a blurry photo of a body of water, possibly a lake, with mountains in the background, boats in the water, and a boat sitting on top of a rocky beach.",,,,
100517,"an aerial view of a field with a dirt road and a river running through it, a forest with a mountain in the background, and a river running through the forest.",,,,
100518,a blurry panoramic view of a river running through a forest with a rocky outcropping and trees in the background.,,,,
100519,"an aerial view of a river running through a forest, the scene includes a field and a mountain.",,,,
100520,"a blurry photo of a waterfall view from a boat on a river, including a body of water and a cliff in the background.",,,,
100521,a panoramic view of a desert landscape with an orange helicopter and a plane flying in the sky.,,,,
100522,"a blurry photo of a large body of water with a boat traveling on it, surrounded by mountains in the background.",,,,
100523,a view of a group of people riding on the back of a boat in a body of water with mountains in the background.,,,,
100524,"a 3D image of a beach under a cloudy sky, the beach including a river, rocks in the foreground, a body of water, and a mountain in the background.",,,,
100525,"a boat traveling on a large body of water, possibly a lake or river, with mountains and a forest in the background, and a group of people standing on top of the boat.",,,,
100526,"a computer generated image of a large body of water under a cloudy sky, the view includes a forest, a lake with a mountain in the background, captured from both bird's eye and aerial perspectives.",,,,
100527,"a view of a river with rapids running through a canyon, with mountains and a waterfall in the background, a man standing on top of the river, and a mountain side with a sign that says airpano",,,,
100528,"a view from a boat of a man riding a kayak on a river, the river runs through a rocky area with a mountain side that has a sign reading 4upanoo.",,,,
100529,"a view of a man and a group of people riding down a river on a yellow raft and a surfboard, as seen from a boat in the water.",,,,
100530,"a view of a river from a moving yellow boat, the river with a sign in the middle of it and a mountain in the background.",,,,
100531,"a view of a river running through a canyon in the mountains, including a man kayaking, rocks, water, and a sign that reads 'airpano'.",,,,
100532,"a red raft is going down a rocky river with trees and a mountain in the background, the river is running through a canyon.",,,,
100534,an aerial view of a small island in the middle of the ocean,,,,
100535,"a bird's eye view of a tropical island in the middle of the ocean, the island surrounded by a large body of water and mountains.",,,,
100536,"an aerial view of a boat traveling down a river next to a lush green hillside, surrounded by trees, an island in the middle of a large body of water, leading to a tropical island in the ocean.",,,,
100539,"a computer generated 3D image of a tropical island in the middle of a large body of water, the island is surrounded by trees and land.",,,,
100541,"an aerial view of a lake surrounded by trees, with a boat in the middle and mountains in the background.",,,,
100543,"a view of a large body of water with a small island, trees in the background, and an aerial perspective.",,,,
100551,"an aerial view of a small town with a church, a large body of water, and a beach, also featuring a cityscape in the background.",,,,
100565,"a panoramic aerial view of a city with tall buildings, a river running through it and boats in the water.",,,,
100586,"a 3d image of a river running through a canyon, the canyon including a mountain in the background, a pool of water with a fish swimming.",,,,
